<?xml version="1.0" encoding="UTF-8" ?>
<xsd:schema xmlns="http://www.lagou.com/xml"
            xmlns:xsd="http://www.w3.org/2001/XMLSchema"
            targetNamespace="http://www.lagou.com/xml" elementFormDefault="qualified">

    <xsd:element name="users" type="usersType"/>
    <xsd:complexType name="usersType">
        <xsd:sequence>
            <xsd:element name="user" type="userType" minOccurs="0" maxOccurs="unbounded"/>
        </xsd:sequence>
    </xsd:complexType>

    <xsd:complexType name="userType">
        <xsd:sequence>
            <xsd:element name="name" type="xsd:string"/>
            <xsd:element name="age" type="ageType" />
            <xsd:element name="hobby" type="hobbyType" />
        </xsd:sequence>
        <xsd:attribute name="id" type="numberType" use="required"/>
    </xsd:complexType>

    <xsd:simpleType name="ageType">
        <xsd:restriction base="xsd:integer">
            <xsd:minInclusive value="0"/>
            <xsd:maxInclusive value="100"/>
        </xsd:restriction>
    </xsd:simpleType>

    <xsd:simpleType name="hobbyType">
        <xsd:restriction base="xsd:string">
            <xsd:enumeration value="抽烟"/>
            <xsd:enumeration value="喝酒"/>
            <xsd:enumeration value="烫头"/>
        </xsd:restriction>
    </xsd:simpleType>

    <xsd:simpleType name="numberType">
        <xsd:restriction base="xsd:string">
            <xsd:pattern value="\d{3}"/>
        </xsd:restriction>
    </xsd:simpleType>

</xsd:schema>